framework/config.json

{   
    "info": "Calibrated April 2025 by Ria Haapala and Stuart Kerr",
    "channel_keys": ["A", "B", "Ap", "Bp", "C4", "C5", "C6", "C7"],
    "ccu": {
        "port": "COM4",
        "baudrate": 19200,
        "ignore": ["A'", "C5", "C7"],
        "plot_xlim": 60,
        "plot_smoothing": 0.5,
        "channel_keys": ["A", "B", "Ap", "Bp", "C4", "C5", "C6", "C7"]
    },
    "laser": {
        "port": "COM10",
        "baudrate": 9600,
        "plot_xlim": 60,
        "plot_smoothing": 0.5
    },
    "motors": {
        "C_UV_HWP": {
            "type": "Elliptec",
            "port": "COM5",
            "address": "0",
            "offset": -26.431
        },
        "C_QP": {
            "type": "Elliptec",
            "port": "COM11",
            "address": "0",
            "offset": 0
        },
        "C_PCC": {
            "type": "Elliptec",
            "port": "COM12",
            "address": "0",
            "offset": -24.5
        },
        "B_C_HWP": {
            "type": "Elliptec",
            "port": "COM7",
            "address": "1",
            "offset": -0.554
        },
        "B_C_QWP": {
            "type": "Elliptec",
            "port": "COM7",
            "address": "0",
            "offset": 127.484
        },
        "B_HWP": {
            "type": "ThorLabs",
            "sn": 83811901,
            "offset": -5.914
        },
        "B_QWP": {
            "type": "ThorLabs",
            "sn": 83811646,
            "offset": 99.724
            
        },
        "A_HWP": {
            "type": "ThorLabs",
            "sn": 83811904,
            "offset": -0.285
        },
        "A_QWP": {
            "type": "ThorLabs",
            "sn": 83811667,
            "offset": -0.710
        }
    },
    "basis_presets": {
        "A_HWP": {
            "H": 0,
            "V": 45.0,
            "D": 67.5,
            "A": 22.5,
            "R": 0,
            "L": 0,
            "P": 56.25,
            "B": 11.25,
            "Z": 33.75,
            "S": -11.25,
            "0": 1.1
        },
        "B_HWP": {
            "H": 0.0,
            "V": 45.0,
            "D": 67.5,
            "A": 22.5,
            "R": 0.0,
            "L": 0.0,
            "P": 56.25,
            "B": 11.25,
            "Z": 33.75,
            "S": -11.25,
            "0": 6.12
        },
        "A_QWP": {
            "H": 0.0,
            "V": 0.0,
            "D": 0.0,
            "A": 0.0,
            "R": 45.0,
            "L": 135.0,
            "B": 0.0,
            "P": 0.0,
            "Z": 0.0,
            "S": 0.0,
            "0": -0.46
        },
        "B_QWP": {
            "H": 0.0,
            "V": 0.0,
            "D": 0.0,
            "A": 0.0,
            "R": 45.0,
            "L": 135.0,
            "B": 0.0,
            "P": 0.0,
            "Z": 0.0,
            "S": 0.0,
            "0": -97.08
        }
    },
    "state_presets": {
        "phi_plus": {
            "C_UV_HWP": -64.14652091578432, 
            "C_QP": -15.6788,
            "C_PCC": 1,
            "B_C_HWP": 0.00,
            "B_C_QWP": 0.00
        },
        "phi_minus": {
            "C_UV_HWP": -66.13495202781274, 
            "C_QP": -16.20877,
            "C_PCC": 0.6764705882352944,
            "B_C_HWP": 0.00,
            "B_C_QWP": 0.00
        },
        "phi_minus_i": {
            "C_UV_HWP": -112.41754451550933, 
            "C_QP": 0,
            "C_PCC": -0.3157894736842106,
            "B_C_HWP": 0.00,
            "B_C_QWP": 0.00
        },
        "HH": {
            "C_UV_HWP": 45,
            "C_QP": -24.1215,
            "C_PCC": 4.005,
            "B_C_HWP": 0.00,
            "B_C_QWP": 0.00
        },
        "VV": {
            "C_UV_HWP": 0,
            "C_QP": 0,
            "C_PCC": 4.005,
            "B_C_HWP": 0.00,
            "B_C_QWP": 0.00
        },
        "VX": {
            "C_UV_HWP": 0,
            "C_QP": 0,
            "C_PCC": 4.005,
            "B_C_QWP": 0.00
        }
    },
    "full_tomography": ["LA", "RA", "VA", "HA", "DA", "AA", 
        "AD", "DD", "HD", "VD", "RD",  "LD",
         "LH", "RH", "VH", "HH", "DH", "AH", 
         "AV", "DV", "HV", "VV", "RV", "LV",
         "LL", "RL", "VL", "HL", "DL", "AL",
         "AR", "DR", "HR", "VR", "RR", "LR"]
}

lab_notebook.markdown

## 7/23/23

MP: O
Laser was on from Friday. Experiment 1: setting PhiP, but then analyzed UV_HWP=10, 22.5, 45; taking full tomo so we can try my method and Alec's for measuring phase. Visually, the measurement motors do not look at 0--actually more like 10 degrees.

Purity is looking really low at 10 (.7778) and 22.5 (.4926), but at 45 it's .9475... Tested on settings found in Richard's updated full tomo for PhiP (but left Bob at 0 instead of 45, so realized making PsiM): purity of .9213. Inspected the setup and noticed that the BBO N2 tube was slightly intersecting the beam, so I fixed it and am retaking PsiM. I also noticed that Bob's C_HWP is partially intersecting the beam as well...This slightly increased purity: .92256.

## 7/21/23

I wasn't super great at writing down everything I did today but basically I just calibrated phi plus. I started with a full QP sweep then I had some sign errors so i rotated the UVHWP to 67.5 to get rid of them. Then I did a ratio tuning sweep and then another phi sweep and then another ratio tuning sweep to really narrow in on the state. Unfortunately, I really do think the drift of the laser is the major limiting factor in these experiments, so I don't know if it's really all that possible to do much better than we have already done in the past.

### Fixing the issue with Elliptec BCQWP Motor

All angles here are based on calibrated zeros
- UVHWP to 0
- QP to 0
- PCC to 4.005
- AHWP to 0
- AQWP to 0

### Back to debugging count rates

Booted ipython and performed the following
- UVHWP, QP, AQWP, AHWP to 0, PCC to 4.005
- Witnessed count rates between 10 and 30.
- Moved A_HWP to 45.
- Count rates jumped to ~1000 for both C4 and C6.
- Moved BQWP, BHWP, BCHWP, and BCQWP to zero but count rates remained high, ~1200 on C4 and ~900 on C6. BCQWP is not calibrated, but its fast axis is visually relatively vertical. However, if I move the fast axis to -30 degrees from the vertical, we see a minimum of ~5 counts/second! I hypothesize that I likely wrenched this component in there so hard that I knocked the plate holding the crystal about 30 degrees! Yikes. Whatever, as long as we can find the minimum, right?

### Calibrating Alice's QWP

Noticed that at UVHWP=22.5 (I think?) there was not much of a difference in detections as I rotated the measurement waveplate. Testing UVHWP=0 seemed to work okay though (significant difference in detection rates). I used 0 for the rest of the measurement waveplate testing.

### Creating VV

The UVHWP angle is really all we need to create the VX state (UVHWP->0). I'm putting an entry in the config file for this. I'll use the 4.005 deg value for the PCC and 0 for the QP. I'm not putting an entry for Bob's Creation HWP yet since we still don't care about that photon.

## Basic motor testing

- Bob's QWP
    - Startup position -97.08 consistent with offset. Dial reads 9ish degrees.
    - `goto(0)` sent it to 106ish degrees.
    - `hardware_home()` returned dial to 9ish.
    - **OKAY** 
- Bob's HWP
    - Init pos 6.12, dial at 37.somethingish.
    - `goto(0)` sent to 31ish
    - `hardware_home()` sent to 37ish
    - **OKAY**
- Alice QWP
    - Init position -0.45, dial at 0.3ish degrees.
    - `goto(20)` caused a crash! "Exception: Getting status failed: Time out while waiting for hardware unit to respond."
    - The motor moved! After the crash the dial reads 3.2ish degrees.
- During shutdown, all Motors except A_QWP successfully zeroed (however they were all already at 0 so not sure if that means they all *work* work).
- Exiting python, booting APT User.
    - Christ. ThorLabs APT now shows all motors at 0 position, even Alice's QWP that moved from it's zero position before the crash. This means that **Alice's measurement waveplates are almost certainly not aligned anymore.**
- I'm confused why this one crashed and the others didn't.
    - I notice that in Kinesis that is now the only motor giving the "Motor Error Detected: (Value - Position Error(0)) (Value - Position Error(0))" error now! Fascinating!!! (Note: all of the motors are still giving the serial number error.)
    - I don't know why... hmmmmmmm!
- Restarting Alice's QWP (SN.904) since it has already lost it's home and is now the only one causing problems.
- I tried moving the USB for Alice's QWP to the USB hub on the table instead of the PC port it was using.
- Booting Kinesis again to checkout error logs. 904 is still giving the position error.
- Tried moving it using ThorLabs APT. No motion, instant USB communications error. Recommended restart. Trying that now. This time I'm restarting it without unplugging the USB.
- Booting Kinesis. The motor didn't even appear! Accidentally booted User APT and it did appear. Trying to move it crashed at 0.0031 degrees, showing the same FT_IO_ERROR.
- Attempting to reconnect the cable to the same port on the computer that it was using before.
- Booting Kinesis shows the same position error.
- Trying to move the motor in python resulted in the same "internal error"
- Launching Kinesis real quick to make sure nothing changed, then I'm going to try a careful system reboot. Yep nothing changed, same position error only on SN.904.

## 7/14/23

I tried booting User APT while running the Manager and only Bob's HWP showed up - as though it was not in touch with the Manager at all! Furthermore every software that pings the motors position is returning 6.12. B_HWP's offset is -6.12, so this means that the motor hardware believes it is in the zero position. Looking at the dial it appears to be at ~41 degrees. This is not good, because reconstructing Richard's code indicates that the motor should have been set to a true position of 196.337 degrees. There is nothing special about the 41 degree number, and so it would seem to me (especially from the stack-trace of the error message I saw) that the Motor failed mid-move, giving us no way of knowing it's true position or how to get it back to zero. Huge yikes!

## 7/7/23

MP: O
Started warming up laser at 20:15. Plan is to re-take data for E0; eta fixed at 45, 60, and 22.5 degrees, sweeping chi from 0 to 90; change is using VV / (VV+HH) and HH / (VV + HH) in BBO and sweeping negative QP angles. At 22:44, started taking data using 'ertias_2_fita2.csv' in oscar/machine_learning/decomp.

Trial 27: fix eta = 45, 60, 22.5 and iterate chi over 0 to 90 in 6 steps like before, but this time I've changed the calculations based on last night's fit to use negative values of QP rot. Realized making states with -chi again, since I still returned -phi in QP function in InstaQ.

Trial 38: retrying with new calculations. For some reason, eta = 60 degrees results in low (~80% fidelity), which is coming from off-diagonal components: seems like imaginary components are close in mag and have correct sign, but real parts have same issue as trial 26 in terms of magnitude but also have incorrect sign. Same with eta = 22.5 degrees: magnitudes close-ish, but wrong sign on real part; magnitudes actually quite close! 0.703 vs 0.707.

## 7/3/23

MP: O
Started laser at 2:45. Had talk with Prof. Lynn earlier and removed PCC from calculations, removed phase from BBO calc, using Alec's QP vs phi data fitted to a curve in QP calculations. Setting PCC to 4.005 degrees as per the phi_plus.

# 4/11/2024

Today we identified the UVHWP, BCHWP, and PCC as having lost calibration, and then manually calibrated the UVHWP (seeing that all of Alice's and Bob's side were good) by checking for maximal counts in hh basis and minimal in vv basis, and that at 22.5 deg there are equal ish counts in hh and vv basis. Output in vv_sweep_go.csv and uvhwpcheck1.png. The goal forward is to start from beginning of pcc/phi plus calibration next time!